,company,job_header,job_description
10,"FireEye, Inc.",Mandiant Red Team Internship - Summer 2022,"Company Description

FireEye is the intelligence-led security company. Working as a seamless, scalable extension of customer security operations, FireEye offers a single platform that blends innovative security technologies, nation-state grade threat intelligence, and world-renowned Mandiant® consulting. With this approach, FireEye eliminates the complexity and burden of cyber security for organizations struggling to prepare for, prevent, and respond to cyber attacks. Learn more about FireEye's world-class solutions and global footprint at https://www.fireeye.com/company.html.

Job Description

A successful Red Team intern at Mandiant should possess an understanding of both information security and computer science. They should understand basic concepts such as networking, applications, and operating system functionality and be able to learn advanced concepts such as application manipulation, exploit development, and stealthy operations. This is not a “press the ‘pwn’ button” type of job; this career is technical and challenging with opportunities to work in some of the most exciting areas of security consulting on extremely technical and challenging work. A typical job could be breaking into a segmented secure zone at a Fortune 500 bank, reverse engineering an application and encryption method in order to gain access to sensitive data, all without being detected. If you can exploit at scale while remaining stealthy, identify and exploit misconfigurations in network infrastructure, parse various types of output data, present relevant data in a digestible manner, think well outside the box, or are astute enough to quickly learn these skills, then you’re the type of consultant we’re looking for.
As a Mandiant intern, you’ll get hands-on experience with complex problems on a daily basis. We help our clients protect their most sensitive and valuable data through comprehensive and real-world scenario testing. The objective doesn’t end at gaining “domain admin” or “root”; this is expected and is only a starting point.
You are expected to quickly assimilate new information as you will face new client environments on a weekly or monthly basis. You will be expected to understand all the threat vectors to each environment and properly assess them. You will get to work with some of the best red teamers in the industry, causing you to develop new skills as you progress through your career. Are you up to the challenge?
What You Will Do:
Perform network penetration, web and mobile application testing, source code reviews, threat analysis, wireless network assessments, and social-engineering assessments
Develop comprehensive and accurate reports and presentations for both technical and executive audiences
Effectively communicate and discuss findings and strategy with internal stakeholders including leadership and technical team members
Recognize and safely utilize attacker tools, tactics, and procedures
Develop scripts, tools, or methodologies to enhance Mandiant’s red teaming processes

Qualifications

Minimum Requirements:
1+ years’ experience, via internships, classes, projects and similar, in at least three of the following:
Network penetration testing and manipulation of network infrastructure
Mobile and/or web application assessments
Email, phone, or physical social-engineering assessments
Shell scripting or automation of simple tasks using Perl, Python, or Ruby
Developing, extending, or modifying exploits, shellcode or exploit tools
Developing applications in C#, ASP, .NET, ObjectiveC, Go, or Java (J2EE)
Reverse engineering malware, data obfuscators, or ciphers
Source code review for control flow and security flaws
1+ years’ exposure working with tools used for wireless, web application, and network security testing
Understanding of network protocols, data on the wire, and covert channels
Understanding of Unix/Linux/Mac/Windows operating systems, including bash and Powershell
Must be eligible to work in Canada without sponsorship
Preferred Qualifications:
Prior experience in a technical security internship
Experience in security competitions, CTFs and/or testing platforms such as Hack the Box, TryHackMe, Overthewire, etc
Related projects around cybersecurity, programming, etc
Strong technical acumen and ability to quickly assimilate new information
Ability to successfully interface with clients (internal and external) and manage expectations of others
Ability to document and explain technical details in a concise, understandable manner

Additional Information

At FireEye we are committed to our #OneTeam approach combining diversity, collaboration, and excellence. All qualified applicants will receive consideration for employment without regard to race, sex, color, religion, sexual orientation, gender identity, national origin, protected veteran status, or on the basis of disability."
11,Publicis Sapient,Junior Software Engineer Intern – Class of 2023,"Company Description

Publicis Sapient is a digital transformation partner helping established organizations get to their future, digitally-enabled state, both in the way they work and the way they serve their customers. We help unlock value through a start-up mindset and modern methods, fusing strategy, consulting and customer experience with agile engineering and problem-solving creativity. United by our core values and our purpose of helping people thrive in the brave pursuit of next, our 20,000+ people in 53 offices around the world combine experience across technology, data sciences, consulting and customer obsession to accelerate our clients’ businesses through designing the products and services their customers truly value. Publicis Sapient is the digital business transformation hub of Publicis Groupe. For more information, visit www.publicissapient.com

Job Description

As a Software Engineer Intern, you’ll gain first-hand experience creating imaginative solutions for our clients and you’ll see your ideas become reality. You will be on a team with other engineering and product management interns to develop a digital, full-stack solution for a real client challenge. At the end of your internship, you’ll be considered for a full-time position that starts upon completion of your degree program. Ready to start your exhilarating career?
Your Impact:
Design, develop and unit test applications
Participate in peer reviews of solution designs and related code
Package and support the deployment of releases
Analyze and resolve technical and application problems
Adhere to high-quality development principles while delivering solutions
Prepare reports, manuals, and other documentation

Qualifications

We recognize that you might not meet 100% of the requirements listed below and that’s okay! We’d love to hear from you anyways.
Required Qualifications
Working towards a BS/BA degree in Computer Science, Computer Engineering, or related area
On track to graduate between December 2022 and August 2023
Comprehensive understanding of Computer Science fundamentals including object-oriented design, data structures, algorithm design, and complexity analysis
Foundational knowledge of object-oriented programming languages
Strong academic track record
Relevant leadership experience from community organization involvement or previous employment
Desired Qualifications
Solid interpersonal and communication skills
Ability to adapt and flex in a fast-paced and collaborative environment
Outstanding problem-solving ability

Additional Information

Benefits of Working Here
Support and tools to be coached and mentored; hands-on experience to sharpen your skills and learn from industry experts
Social and community service events

Application Tips
Applications will be accepted until November 1st, 2021.

In order for your application to be considered complete, you must upload both your resume and unofficial transcript. A cover letter is optional but recommended.

Once you submit your application, you will hear back from us within 5 business days on next steps.

We have this position available in our Toronto office.

When you are ready to submit your application, click the ""I'm interested"" button to the right.

Publicis Sapient is an Equal Opportunity Employer
As part of our dedication to an inclusive and diverse workforce, Publicis Sapient is committed to Equal Employment Opportunity without regard for race, color, national origin, ethnicity, gender, protected veteran status, disability, sexual orientation, gender identity, or religion. We are also committed to providing reasonable accommodations for qualified individuals with disabilities and disabled veterans in our job application procedures. If you need assistance or an accommodation due to a disability, contact us at hiring@publicissapient.com or call us at +1-617-621-0200.

For more information about Publicis Sapient, visit here: https://www.publicissapient.com/about"
